{"cosign":{"binaries":{"amd64":"4629c757b7618056f8ddd7e2625ae9fdd94c0372a65049520bc7d9df9efc7f71","arm64":"c5d324e091826b0d7a78eb16fef316450b4eb9aaec045611c08ba06f5e73220a"},"version":"3.1.3"},"deniedManifestDigests":[],"deniedSigners":[],"minimumReleaseSequence":1,"overlap":{"previousSequence":null,"requiredSignerCount":1},"schemaVersion":"skillwire.trust-policy/v1","sequence":1,"signers":[{"issuer":"https://token.actions.githubusercontent.com","refPattern":"refs/tags/self-hosted-v*","repository":"Lucenx9/skillwire","signerId":"github-release-primary","workflow":".github/workflows/self-hosted-release.yml"}],"trustedRoot":{"mediaType":"application/vnd.dev.sigstore.trustedroot+json;version=0.1","path":"trusted-root.v1.json","sha256":"6494e21ea73fa7ee769f85f57d5a3e6a08725eae1e38c755fc3517c9e6bc0b66"},"validFrom":"2026-01-01T00:00:00.000Z","validUntil":"2027-01-01T00:00:00.000Z"}